{
  "$schema": "https://json-schema.org/draft/2020-12/schema",
  "$id": "https://agent-ready.dev/schemas/config.schema.json",
  "title": "agent-ready config",
  "type": "object",
  "additionalProperties": false,
  "properties": {
    "schemaVersion": {
      "type": "string"
    },
    "profiles": {
      "type": "array",
      "items": {
        "type": "string"
      }
    },
    "profile": {
      "oneOf": [
        {
          "type": "string"
        },
        {
          "type": "array",
          "items": {
            "type": "string"
          }
        }
      ]
    },
    "ignore": {
      "type": "array",
      "items": {
        "type": "string"
      }
    },
    "riskPaths": {
      "type": "array",
      "items": {
        "type": "string"
      }
    },
    "generatedPaths": {
      "type": "array",
      "items": {
        "type": "string"
      }
    },
    "directoryRoles": {
      "type": "object",
      "additionalProperties": {
        "type": "string"
      }
    },
    "commands": {
      "type": "object",
      "additionalProperties": {
        "oneOf": [
          {
            "type": "string"
          },
          {
            "type": "object",
            "additionalProperties": false,
            "required": ["command"],
            "properties": {
              "command": {
                "type": "string"
              },
              "requiresNetwork": {
                "type": "boolean"
              },
              "writesFiles": {
                "type": "boolean"
              },
              "risk": {
                "type": "string",
                "enum": ["low", "medium", "high"]
              }
            }
          }
        ]
      }
    },
    "sections": {
      "type": "object",
      "additionalProperties": false,
      "properties": {
        "purpose": {
          "type": "string"
        },
        "conventions": {
          "type": "array",
          "items": {
            "type": "string"
          }
        }
      }
    }
  }
}
